{
  "$schema": "../../schemas/orchestrator-profile-v1.schema.json",
  "version": 1,
  "profileId": "canonical-orchestrator",
  "roles": [
    "orchestrator",
    "planner",
    "coder",
    "restricted-coder",
    "reviewer",
    "tester",
    "documenter",
    "security_reviewer",
    "writer",
    "editor"
  ],
  "providers": {
    "codex": {
      "agent": "codex",
      "provider": "codex",
      "execution": "available",
      "argvOwner": "D/0/01",
      "aliases": {
        "gpt-6": "gpt-6-astra",
        "astra": "gpt-6-astra",
        "gpt-6.1": "gpt-6.1-sol",
        "gpt-5.6": "gpt-5.6-sol",
        "sol": "gpt-5.6-sol",
        "terra": "gpt-5.6-terra",
        "luna": "gpt-5.6-luna"
      },
      "defaultModel": "gpt-6.1-sol",
      "defaultReasoningEffort": "max",
      "serviceTiers": ["default", "priority"],
      "defaultServiceTier": "priority",
      "models": {
        "gpt-6-astra": {
          "reasoningEfforts": ["low", "medium", "high", "xhigh", "max", "ultra"],
          "defaultReasoningEffort": "max"
        },
        "gpt-6.1-sol": {
          "reasoningEfforts": ["low", "medium", "high", "xhigh", "max", "ultra"],
          "defaultReasoningEffort": "max"
        },
        "gpt-5.6-sol": {
          "reasoningEfforts": ["low", "medium", "high", "xhigh", "max", "ultra"],
          "defaultReasoningEffort": "max"
        },
        "gpt-5.6-terra": {
          "reasoningEfforts": ["low", "medium", "high", "xhigh", "max", "ultra"],
          "defaultReasoningEffort": "max"
        },
        "gpt-5.6-luna": {
          "reasoningEfforts": ["low", "medium", "high", "xhigh", "max"],
          "defaultReasoningEffort": "max"
        },
        "gpt-5.5": {
          "reasoningEfforts": ["low", "medium", "high", "xhigh"],
          "defaultReasoningEffort": "medium"
        },
        "gpt-5": {
          "reasoningEfforts": ["low", "medium", "high", "xhigh"],
          "defaultReasoningEffort": "medium"
        },
        "gpt-5-codex": {
          "reasoningEfforts": ["low", "medium", "high", "xhigh"],
          "defaultReasoningEffort": "medium"
        }
      }
    },
    "claude-code": {
      "agent": "claude-code",
      "provider": "claude-code",
      "execution": "available",
      "argvOwner": "D/0/01",
      "aliases": {
        "fable": "claude-fable-5",
        "opus": "claude-opus-5",
        "sonnet": "claude-sonnet-5",
        "opus-5": "claude-opus-5",
        "sonnet-5.5": "claude-sonnet-5-5",
        "opus-5.5": "claude-opus-5-5",
        "opus-5-5": "claude-opus-5-5"
      },
      "defaultModel": "claude-opus-5-5",
      "defaultReasoningEffort": "max",
      "serviceTiers": null,
      "defaultServiceTier": null,
      "models": {
        "claude-sonnet-5": {
          "reasoningEfforts": ["low", "medium", "high", "xhigh", "max"],
          "defaultReasoningEffort": null
        },
        "claude-sonnet-5-5": {
          "reasoningEfforts": ["low", "medium", "high", "xhigh", "max"],
          "defaultReasoningEffort": null
        },
        "claude-fable-5-1": {
          "reasoningEfforts": ["low", "medium", "high", "xhigh", "max"],
          "defaultReasoningEffort": null
        },
        "claude-fable-5": {
          "reasoningEfforts": ["low", "medium", "high", "xhigh", "max"],
          "defaultReasoningEffort": null
        },
        "claude-opus-5-5": {
          "reasoningEfforts": ["low", "medium", "high", "xhigh", "max"],
          "defaultReasoningEffort": null
        },
        "claude-opus-5": {
          "reasoningEfforts": ["low", "medium", "high", "xhigh", "max"],
          "defaultReasoningEffort": null
        },
        "claude-opus-4-8": {
          "reasoningEfforts": ["low", "medium", "high", "xhigh", "max"],
          "defaultReasoningEffort": null
        }
      }
    },
    "gemini-cli": {
      "agent": "gemini-cli",
      "provider": "gemini-cli",
      "execution": "registry-only",
      "argvOwner": "unavailable",
      "aliases": {},
      "defaultModel": "gemini-2.5-pro",
      "defaultReasoningEffort": null,
      "serviceTiers": null,
      "defaultServiceTier": null,
      "models": {
        "gemini-2.5-pro": {
          "reasoningEfforts": null,
          "defaultReasoningEffort": null
        },
        "gemini-2.5-flash": {
          "reasoningEfforts": null,
          "defaultReasoningEffort": null
        }
      }
    },
    "antigravity": {
      "agent": "antigravity",
      "provider": "antigravity",
      "execution": "available",
      "argvOwner": "D/0/01",
      "aliases": {
        "gemini-3.8-flash": "gemini-3.8-flash-high",
        "gemini-3.7-flash": "gemini-3.7-flash-high",
        "gemini-3.6-flash": "gemini-3.6-flash-high",
        "gemini-3.5-flash": "gemini-3.5-flash-high",
        "gemini-3.1-pro": "gemini-3.1-pro-high"
      },
      "defaultModel": "gemini-3.8-flash-high",
      "defaultReasoningEffort": "high",
      "serviceTiers": null,
      "defaultServiceTier": null,
      "models": {
        "gemini-3.8-flash-high": {
          "reasoningEfforts": ["low", "medium", "high"],
          "defaultReasoningEffort": "high"
        },
        "gemini-3.8-flash-medium": {
          "reasoningEfforts": ["low", "medium", "high"],
          "defaultReasoningEffort": "high"
        },
        "gemini-3.8-flash-low": {
          "reasoningEfforts": ["low", "medium", "high"],
          "defaultReasoningEffort": "high"
        },
        "gemini-3.7-flash-high": {
          "reasoningEfforts": ["low", "medium", "high"],
          "defaultReasoningEffort": "high"
        },
        "gemini-3.7-flash-medium": {
          "reasoningEfforts": ["low", "medium", "high"],
          "defaultReasoningEffort": "high"
        },
        "gemini-3.7-flash-low": {
          "reasoningEfforts": ["low", "medium", "high"],
          "defaultReasoningEffort": "high"
        },
        "gemini-3.6-flash-high": {
          "reasoningEfforts": ["low", "medium", "high"],
          "defaultReasoningEffort": "high"
        },
        "gemini-3.6-flash-medium": {
          "reasoningEfforts": ["low", "medium", "high"],
          "defaultReasoningEffort": "high"
        },
        "gemini-3.6-flash-low": {
          "reasoningEfforts": ["low", "medium", "high"],
          "defaultReasoningEffort": "high"
        },
        "gemini-3.5-flash-high": {
          "reasoningEfforts": ["low", "medium", "high"],
          "defaultReasoningEffort": "high"
        },
        "gemini-3.5-flash-medium": {
          "reasoningEfforts": ["low", "medium", "high"],
          "defaultReasoningEffort": "high"
        },
        "gemini-3.5-flash-low": {
          "reasoningEfforts": ["low", "medium", "high"],
          "defaultReasoningEffort": "high"
        },
        "gemini-3.1-pro-high": {
          "reasoningEfforts": ["low", "medium", "high"],
          "defaultReasoningEffort": "high"
        },
        "gemini-3.1-pro-low": {
          "reasoningEfforts": ["low", "medium", "high"],
          "defaultReasoningEffort": "high"
        }
      }
    },
    "pi": {
      "agent": "pi",
      "provider": "pi",
      "execution": "available",
      "argvOwner": "D/0/01",
      "aliases": {
        "qwen": "ollama/qwen3.8:27b",
        "qwen-coder": "ollama/qwen3-coder:30b",
        "kimi": "moonshotai/kimi-k3",
        "kimi-k3": "moonshotai/kimi-k3"
      },
      "defaultModel": "ollama/qwen3.8:27b",
      "defaultReasoningEffort": "medium",
      "serviceTiers": null,
      "defaultServiceTier": null,
      "models": {
        "ollama/qwen3.8:27b": {
          "reasoningEfforts": ["off", "minimal", "low", "medium", "high", "xhigh"],
          "defaultReasoningEffort": "medium"
        },
        "ollama/qwen3-coder:30b": {
          "reasoningEfforts": ["off", "minimal", "low", "medium", "high", "xhigh"],
          "defaultReasoningEffort": "medium"
        },
        "moonshotai/kimi-k3": {
          "reasoningEfforts": ["off", "minimal", "low", "medium", "high", "xhigh"],
          "defaultReasoningEffort": "medium"
        }
      }
    },
    "opencode": {
      "agent": "opencode",
      "provider": "opencode",
      "execution": "available",
      "argvOwner": "D/0/01",
      "aliases": {
        "qwen": "ollama/qwen3.8:27b",
        "qwen-coder": "ollama/qwen3-coder:30b",
        "kimi": "moonshotai/kimi-k3",
        "kimi-k3": "moonshotai/kimi-k3"
      },
      "defaultModel": "ollama/qwen3.8:27b",
      "defaultReasoningEffort": null,
      "serviceTiers": null,
      "defaultServiceTier": null,
      "models": {
        "ollama/qwen3.8:27b": {
          "reasoningEfforts": null,
          "defaultReasoningEffort": null
        },
        "ollama/qwen3-coder:30b": {
          "reasoningEfforts": null,
          "defaultReasoningEffort": null
        },
        "moonshotai/kimi-k3": {
          "reasoningEfforts": null,
          "defaultReasoningEffort": null
        }
      }
    }
  },
  "prerequisites": {
    "F/0/03": {
      "availability": "unavailable",
      "capability": "review-gate"
    },
    "F/0/04": {
      "availability": "unavailable",
      "capability": "completion-integration"
    }
  },
  "workflows": {
    "plan": {
      "promptId": "orchestrator.plan.v1",
      "instruction": "Create a trace, assign a planner, and persist a typed plan artifact before execution.",
      "tools": [
        "orchestration.create",
        "orchestration.view",
        "task.assign",
        "agent.spawn",
        "agent.ask",
        "agent.view",
        "artifact.put",
        "artifact.list"
      ],
      "artifacts": ["plan", "summary"],
      "prerequisites": []
    },
    "execute": {
      "promptId": "orchestrator.execute.v1",
      "instruction": "Delegate bounded implementation and testing through assigned agents and typed artifacts.",
      "tools": [
        "task.assign",
        "agent.delegate",
        "agent.spawn",
        "agent.ask",
        "agent.view",
        "agent.kill",
        "artifact.put",